titolo,descrizione,path_immagine,link_articolo,data
Istituzione della Banca Centrale Europea,Viene istituita la Banca Centrale Europea che sostituisce l'Istituto Monetario Europeo. Nasce con l'incarico di attuare la politica monetaria per i diciannove paesi dell'Unione europea che hanno aderito alla moneta unica e che formano la cosiddetta zona euro.,https://upload.wikimedia.org/wikipedia/commons/thumb/c/cb/Logo_European_Central_Bank.svg/480px-Logo_European_Central_Bank.svg.png,https://it.wikipedia.org/wiki/Banca_centrale_europea,1946/06/01
Referendum Istituzionale,In questa data in Italia i cittadini e le cittadine che hanno raggiunto la maggiore età si recano alle urne per il Referendum iItituzionale. L'esito vedrà la vittoria a maggoranza della Repubblica ,https://upload.wikimedia.org/wikipedia/it/e/ea/Repubblica_festeggiamenti_1946.jpg,https://it.wikipedia.org/wiki/Festa_della_Repubblica_Italiana,1946/06/02
Elezioni per la XXI legislatura,La XXI legislatura in Italia ebbe inizio nel 1900 e si concluse il 18 ottobre 1904,https://upload.wikimedia.org/wikipedia/commons/thumb/8/8b/La_Domenica_del_Corriere%2C_24_giugno_1900_-_Inaugurazione_XXI_legislatura.jpg/259px-La_Domenica_del_Corriere%2C_24_giugno_1900_-_Inaugurazione_XXI_legislatura.jpg,https://it.wikipedia.org/wiki/XXI_legislatura_del_Regno_d%27Italia,1900/06/03
Viene istituito il Ministero del lavoro e delle politiche sociali,Il Ministero del lavoro e delle politiche sociali è un dicastero del governo italiano che si occupa delle funzioni in materia di politica e sviluppo sull'occupazione.,https://upload.wikimedia.org/wikipedia/commons/thumb/6/6d/Ministero_del_Lavoro_Roma_Via_Veneto.jpg/260px-Ministero_del_Lavoro_Roma_Via_Veneto.jpg,https://it.wikipedia.org/wiki/Ministero_del_lavoro_e_delle_politiche_sociali,1920/06/03
Pubblicazione del Manifesto dei Fasci Italiani di combattimento,Il Manifesto dei Fasci italiani di combattimento è il nome del movimento politico fondato a Milano da Benito Mussolini ,https://upload.wikimedia.org/wikipedia/commons/thumb/5/5f/Logo_Fasci_di_Combattimento.svg/150px-Logo_Fasci_di_Combattimento.svg.png,https://it.wikipedia.org/wiki/Fasci_italiani_di_combattimento#Il_manifesto_programmatico,1919/06/06
La città del Vaticano diventa uno Stato sovrano,"Lo Stato della Città del Vaticano è uno Stato senza sbocco al mare della penisola italiana, governato da una teocrazia.E' il più piccolo Stato Sovrano al mondo sia per estensione che per popolazione.",https://upload.wikimedia.org/wikipedia/commons/thumb/0/00/Flag_of_the_Vatican_City.svg/480px-Flag_of_the_Vatican_City.svg.png,https://it.wikipedia.org/wiki/Citt%C3%A0_del_Vaticano,1929/06/07
Francesco Cocco diventa la prima vittima delle Brigate Rosse,Egli era un procuratore della repubblica di Genova e in passato fu giudice istruttore a Nuoro. Egli nasce il 12 dicembre 1908 a Terralba e morì successivamente l'8 Giugno del 1976 a Genova. ,https://upload.wikimedia.org/wikipedia/it/thumb/e/eb/Francesco-coco-ritratto.jpg/297px-Francesco-coco-ritratto.jpg,https://it.wikipedia.org/wiki/Francesco_Coco_(magistrato),1976/06/08
Fondazione del Comitato Olimpico Nazionale italiano,Il Comitato Olimpico Nazionale è l'organismo del governo dello sport in Italia. Esso nasce inizialmente come organizzazione privata per organizzare sport italiani solo dopo diventò una sede mondiale per gestire tutti gli sport.,https://upload.wikimedia.org/wikipedia/it/thumb/6/6e/Logo_CONI_2014.svg/480px-Logo_CONI_2014.svg.png,https://it.wikipedia.org/wiki/Comitato_olimpico_nazionale_italiano,1914/06/10
L'Italia dichiara guerra alla Francia e alla Gran Bretagna nella Seconda Guerra Mondiale,L'ingresso in questo conflitto rappresenta il completamento del percorso della politica estera di aggressione voluto da Mussolini ,https://it.pearson.com/content/dam/region-core/italy/pearson-italy/images/storia-storialive/ITALY%20-%20DOCENTI%20-%20STORIA%20-%20CULTURA%20STORICA%20-%20Italia%20in%20guerra.jpg.transform/medium-size/img.jpeg,https://it.pearson.com/aree-disciplinari/storia/cultura-storica/novecento-mondo-attuale/italia-guerra-entusiasmo-crollo-consenso.html,1940/06/10
Muiono 378 persone per il bombardamento a Trieste,"In questa data si ricordano tutte quelle persone che morirono nel bombardamento che travolse Trieste e lasciò morti, feriti e molte persone senza case. Questo accadde perchè in quello stesso periodo l'Italia era in guerra e i nemici presero di mira Trieste.",https://upload.wikimedia.org/wikipedia/commons/thumb/6/6c/Free_Territory_Trieste_Flag.svg/480px-Free_Territory_Trieste_Flag.svg.png,https://italia1943.altervista.org/bombardamento-su-trieste/?doing_wp_cron=1636536382.5696198940277099609375,1943/06/10
Nascita dell'Azione Cattolica Italiana,"Essa nasce grazie alla lettera enciclica ""Il fermo propoisito"" di  Papa Pio X",https://upload.wikimedia.org/wikipedia/commons/thumb/2/20/C_o_a_Pius_X.svg/328px-C_o_a_Pius_X.svg.png,https://it.wikipedia.org/wiki/Il_fermo_proposito,1905/06/11
La città dell'Aquila viene liberata dalle truppe nazifasciste ,"Tutto ciò avvenne nella Campagna d'Italia fu l'insieme delle operazioni militari condotte dagli Alleati in Italia nell'ambito della seconda guerra mondiale, nel periodo che va dal giugno 1943 al maggio 1945; la campagna fu intrapresa prima per sconfiggere l'Italia fascista",https://upload.wikimedia.org/wikipedia/commons/thumb/b/b7/L%27Aquila_2011_by-RaBoe-201.jpg/480px-L%27Aquila_2011_by-RaBoe-201.jpg,https://it.wikipedia.org/wiki/Campagna_d%27Italia_(1943-1945),1944/06/13
"Tre carabinieri vengono uccisi da ""Cosa Nostra"" a Palermo","I tre carabinieri uccisi erano Mario D'Aleo,29 anni, comandante della compagnia di carabinieri di Monreale, Giuseppe Bommarito,38 anni, e infine Pietro Morici, 26 anni. Furono uccisi dai sicari di ""Cosa Nostra"" in macchina.",https://upload.wikimedia.org/wikipedia/commons/thumb/5/5d/Coat_of_arms_of_the_Carabinieri.svg/279px-Coat_of_arms_of_the_Carabinieri.svg.png,https://vittimemafia.it/13-giugno-1983-palermo-agguato-via-scobar-uccisi-il-capitano-mario-daleo-e-i-carabinieri-giuseppe-bommarito-e-pietro-morici/,1983/06/13
Mussolini e Hitler si incontrano per la prima volta,In questa data i due dittatori si incontrarono per la prima volta nella storia e ciò cambierà le sorti dell'Iatlia e del mondo; infatti il tema principale del loro colloquio fu la questione austriaca,https://net-storage.tcccdn.com/storage/politicanews.it/img_notizie/thumb3/e1/e19e464d9d0ce527193b101952268b92-29265-a742ae2c5fb03a50de9c43d5dc52a44e.jpeg,https://www.politicanews.it/ricordate/ricordate-14-giugno-1934-mussolini-e-hitler-si-incontrano-per-la-prima-volta-10294,1934/06/14
Viene emanato il primo Testo unico del Codice della strada,Il Codice della strada è un codice della Repubblica italiana che disciplina la circolazione stradale ed indica una generale disciplina dei trasporti.,https://tse1.mm.bing.net/th?id=OIP.90CHyWGumRvMGokU-yru7QAAAA&pid=Api&rs=1&c=1&qlt=95&w=79&h=116,https://it.wikipedia.org/wiki/Codice_della_strada_(Italia),1959/06/15
Guerra Italo-Turca,Da qui iniziano le operazioni per l'occupazione di Misurata,https://upload.wikimedia.org/wikipedia/commons/thumb/f/f1/Italo-Turkish_war_collage.jpg/480px-Italo-Turkish_war_collage.jpg,https://it.wikipedia.org/wiki/Guerra_italo-turca,1912/06/16
Il Tricolore privo dello stemma sabaudo diviene bandiera nazionale della Repubblica Italiana,In quella data grazie al decreto del Presidente del Consiglio dei Ministri venne eliminato lo stemma sabaudo. L'articolo 12 della Costituzione ribadisce che  la bandiera italiana è il tricolore. ,https://upload.wikimedia.org/wikipedia/commons/thumb/0/03/Flag_of_Italy.svg/480px-Flag_of_Italy.svg.png,https://www.politicanews.it/ricordate/ricordate-19-giugno-1946-il-tricolore-privo-dello-stemma-sabaudo-diviene-bandiera-nazionale-della-repubblica-italiana-10968,1946/06/19
In Italia si svolgono le elezioni politiche per il rinnovo dei due rami del Parlamento,Per la prima volta alle lezioni politiche per il rinnovo della Cameradei Deputati (uno dei due rami del Parlamento) votarono anche i diciottenni.,https://upload.wikimedia.org/wikipedia/commons/thumb/0/0f/Elezioni_Camera_1976_Comuni.png/370px-Elezioni_Camera_1976_Comuni.png,https://it.wikipedia.org/wiki/Elezioni_politiche_italiane_del_1976,1976/06/20
L'italia aderisce alla Convenzione di Berna,La Convenzione di Berna nacque per la protezione delle opere letterarie e artistiche; consiste in un accordo internazionale che stabilisce il riconoscimento reciproco del diritto dell'autore tra le nazioni aderenti.,https://tse1.mm.bing.net/th?id=OIP.2MLRYW_7Ua7jGpSMIvx-_QHaDz&pid=Api&rs=1&c=1&qlt=95&w=205&h=105,https://it.wikipedia.org/wiki/Convenzione_di_Berna_per_la_protezione_delle_opere_letterarie_e_artistiche,1978/06/20
Nilde Iotti è la prima donna che viene eletta  Presidente donna della Camera dei deputati,"Nilde Lotti fu la prima donna che ricoprì la terza carica dello Stato, la Presidenza della Camera dei Deputati, incarico che durò per quasi 13 anni, durante 3 legislature.",https://upload.wikimedia.org/wikipedia/it/thumb/e/ec/NildeIotti.jpg/342px-NildeIotti.jpg,https://it.wikipedia.org/wiki/Nilde_Iotti,1979/06/20
Giovanni Battista Montini viene eletto Papa a Roma,"Giovanni Battista Montini, arcivescovo di Milano, assunse il nome di Papa Paolo VI e venne eletto dopo la morte di Papa Giovanni XXIII.",https://upload.wikimedia.org/wikipedia/commons/thumb/b/b0/Paulus_VI%2C_by_Fotografia_Felici%2C_1969.jpg/367px-Paulus_VI%2C_by_Fotografia_Felici%2C_1969.jpg,https://it.wikipedia.org/wiki/Conclave_del_1963,1963/06/21
Viene allestito il Vittoriale degli Italiani,"Esso è un complesso di edifici, vie, piazze, un teatro all'aperto, giardini e corsi d'acqua ",https://upload.wikimedia.org/wikipedia/it/thumb/8/80/Vittoriale_il_complesso_monumentale.jpg/480px-Vittoriale_il_complesso_monumentale.jpg,https://it.wikipedia.org/wiki/Vittoriale_degli_Italiani,1926/06/22
Viene emanata dal governo italiano l'amnistia passata alla storia come l'Amnistia Togliatti,"Questa amnistia fu un provvedimento assunto per l' estinzione delle pene (reati comuni e politici), proposto alla fine della Seconda Guerra Mondiale dal Ministro di Grazia e Giustizia Palmiro Togliatti del PCI. Secondo Togliatti pacificare la nazione era la condizione necessaria per  avviare rapidamente il paese verso una condizione di ""pace sociale e politica"" ",https://tse2.mm.bing.net/th?id=OIP.0Eos8OlHnuXhT0L3cz3GlAHaD4&pid=Api&P=0&w=317&h=167,https://it.wikipedia.org/wiki/Amnistia_Togliatti,1946/06/22
L'Italia vince contro l'impero austroungarico nella seconda battaglia del Piave," Essa fù combattuta tra l'imperiale e regio esercito astro-ungarico e il Regio esercito italiano ed impegno gli austroungarici nella loro ultima grande offensiva della prima guerra mondiale.
",https://upload.wikimedia.org/wikipedia/commons/thumb/6/68/Battle_of_the_Piave_River_1918.jpg/480px-Battle_of_the_Piave_River_1918.jpg,https://it.wikipedia.org/wiki/Battaglia_del_solstizio,1918/06/24
Francesco Consiga è eletto ottavo Presidente della Repubblica Italiana,"Egli è stato un politico, giurista e accademico italiano; è stato uno degli più importanti e influenti Presidenti della Prima Repubblica.",https://upload.wikimedia.org/wikipedia/commons/thumb/2/24/Cossiga_Francesco.jpg/321px-Cossiga_Francesco.jpg,https://it.wikipedia.org/wiki/Francesco_Cossiga,1985/06/24
In Italia si insedia l'Assemblea Costituente ,"L'Assemblea Costituente fu, in Italia, l'organo legislativo elettivo preposto alla stesura di una Costituzione per la neonata Repubblica e che diede vita alla Costituzione della Repubblica Italiana nella sua forma originaria. Le sedute si svolsero fra il 25 giugno 1946 e il 31 gennaio 1948. Votò inoltre la fiducia ai governi che si susseguirono in quel periodo.",https://upload.wikimedia.org/wikipedia/commons/thumb/1/1a/Assemblea_Costituente_1946.svg/480px-Assemblea_Costituente_1946.svg.png,https://it.wikipedia.org/wiki/Assemblea_Costituente_(Italia),1946/06/25
Si celebra la seconda delle due giornate del referendum per l'approvazione del disegno di legge costituzionale,Il secondo referemdum aveva ad oggetto la riforma diretta a modificare sotto più profili la seconda parte della Costituzione italiana.,https://upload.wikimedia.org/wikipedia/commons/thumb/e/e4/Referndum2006.png/381px-Referndum2006.png,https://it.wikipedia.org/wiki/Referendum_costituzionale_in_Italia_del_2006,2006/06/26
Viene firmato il Trattato di Versailles che pone ufficialmente fine alla Prima guerra Mondiale,"Il trattato di Versailles, anche detto patto di Versailles, è uno dei trattati di pace che pose ufficialmente fine alla prima guerra mondiale. Fu stipulato nell'ambito della conferenza di pace di Parigi del 1919 e firmato da 44 Stati il 28 giugno 1919 a Versailles, in Francia, nella galleria degli specchi del palazzo di Versailles. È suddiviso in 16 parti e composto da 440 articoli.",https://upload.wikimedia.org/wikipedia/commons/thumb/1/15/Treaty_of_Versailles_oldphoto.jpg/480px-Treaty_of_Versailles_oldphoto.jpg,https://it.wikipedia.org/wiki/Trattato_di_Versailles_(1919),1919/06/28
Due militanti del Movimento Socialie Italiano vengono uccisi nella sede del MSI a Padova,Esso fu un attentato fatto a Giuseppe Mazzola e Graziano Giralucci ed entrambi furono i primi omicidi commessi dalle Brigate Rosse. ,https://upload.wikimedia.org/wikipedia/commons/thumb/2/22/Movimento_Sociale_Italiano_Logo.svg/480px-Movimento_Sociale_Italiano_Logo.svg.png,https://it.wikipedia.org/wiki/Assalto_alla_sede_del_Movimento_Sociale_Italiano_di_Padova,1974/06/17
