titolo,descrizione,path_immagine,link_articolo,data
"Diviene operativo il Fondo monetario internazionale (FMI), nato formalmente nel dicembre 1945.","Il Fondo Monetario Internazionale, anche abbreviato con FMI o IMF in inglese, fu istituito come parte degli accordi di scambio, nel 1945, durante la conferenza di Bretton Woods.",https://economiafinanzaonline.it/wp-content/uploads/2019/03/FB_FMI.jpg,https://www.google.com/url?sa=i&url=https%3A%2F%2Feconomiafinanzaonline.it%2Ffondo-monetario-internazionale-cose-e-come-funziona%2Fguide%2F&psig=AOvVaw3Np5sB4F1Y7ZOuFcL3KtG0&ust=1635444622943000&source=images&cd=vfe&ved=0CAsQjRxqFwoTCKj655OY6_MCFQAAAAAdAAAAABAD,1947/03/01
"Si conclude il processo per lo scandalo Lockheed: Mario Tanassi è giudicato colpevole, mentre viene assolto Luigi Gui.","Lo scandalo Lockheed in Italia riguardò la fornitura degli aerei da trasporto C-130, ricevuti dall'Aeronautica Militare a partire dal 1972. Nel 1976 molti soggetti coinvolti nelle trattative con la Lockheed furono accusati di aver accettato tangenti per miliardi di lire per favorire l'acquisto di tali aerei da parte del Ministero della Difesa  e alcuni di questi furono condannati (inserisci la condanna il conivolgimento di Giovanni Leone)",https://upload.wikimedia.org/wikipedia/it/d/d4/Lockheed_C-130H_MM61991_Aeronautica_Militare.jpg,https://www.google.com/url?sa=i&url=https%3A%2F%2Fit.wikipedia.org%2Fwiki%2FScandalo_Lockheed_in_Italia&psig=AOvVaw0P3bgf-FobyBqjvjxps2Xa&ust=1636018522292000&source=images&cd=vfe&ved=0CAsQjRxqFwoTCNieo5ny-_MCFQAAAAAdAAAAABAD,1979/03/01
Guerra italo-turca: attacco turco in prossimità di Derna,"Il 13 ottobre il viceammiraglio Aubry ordinò l'occupazione di Derna con le truppe già presenti a Tobruch. Nei giorni successivi altri sbarchi portarono la guarnigione italiana a 250 uomini e l'operazione ebbe termine il 21 ottobre, quando tutto il battaglione fu a terra.",https://upload.wikimedia.org/wikipedia/commons/f/f1/Italo-Turkish_war_collage.jpg,https://it.wikipedia.org/wiki/Guerra_italo-turca#I_primi_scontri_navali_e_l%27occupazione_delle_citt%C3%A0_costiere,1912/03/03
"Nasce il sindacato UIL, dall'unione dei sindacalisti del Partito Socialista Unificato e dei gruppi dì minoranza della (FIL)","La nascita della UIL (Unione Italiana del Lavoro) è avvenuta per tappe ed è frutto sia delle scissioni generate dalla CGIL (Confederazione Generale Italiana del Lavoro) unitaria, sia dei rimescolamenti politici in seno ai partiti politici italiani nel primo dopoguerra repubblicano, in particolare nell'area socialista.",https://upload.wikimedia.org/wikipedia/commons/thumb/c/cb/Sede_centrale_UIL_Roma.jpg/253px-Sede_centrale_UIL_Roma.jpg,https://upload.wikimedia.org/wikipedia/it/thumb/4/43/LAvoro_Italiano_10_Marzo_1950.jpg/220px-LAvoro_Italiano_10_Marzo_1950.jpg,1950/03/05
Naufraga al largo dell'isola di Lampedusa di una nave carica di migranti.,"Nel canale di Sicilia, a 65 miglia da Lampedusa, naufraga un'imbarcazione di sette metri. Sono dodici i clandestini morti, mentre è incerto il numero dei dispersi.",https://st.ilfattoquotidiano.it/wp-content/uploads/2021/05/03/migranti-1-690x362.jpg,,2002/03/07
Giornata Internazionale della Donna.,"La Giornata internazionale dei diritti della donna ricorre l'8 marzo di ogni anno per ricordare sia le conquiste sociali, economiche e politiche, sia le discriminazioni e le violenze di cui le donne sono state e sono ancora oggetto in molte parti del mondo.",https://upload.wikimedia.org/wikipedia/commons/5/5f/WomDay13_%286966402973%29.jpg,https://it.wikipedia.org/wiki/Giornata_internazionale_della_donna,1977/03/08
"Viene abrogato l'articolo 553 del Codice Penale che vietava la produzione, il commercio e la pubblicità degli anticoncezionali.","Il 10 marzo 1971 la Corte Costituzionale abroga l'articolo 553 del Codice Penale e la contraccezione divenne legale: le donne ebbero così riconosciuta la possibilità di utilizzare la pillola anticoncezionale. Questo permise alle donne di autodeterminare le proprie scelte in fatto di maternità, in piena autonomia rispetto alla volontà dei compagni, dei fidanzati, dei mariti.",https://upload.wikimedia.org/wikipedia/commons/thumb/6/65/Utilizzo_della_Pillola_Anticoncezionale_in_Italia.jpg/220px-Utilizzo_della_Pillola_Anticoncezionale_in_Italia.jpg,https://www.brocardi.it/codice-penale/libro-secondo/titolo-x/art553.html,1971/03/10
Vengono pubblicate le prime riviste di fotoromanzi di Bolero e Sogno.,"Il primo ""fumetto fotografico"" pubblicato su «Bolero Film» uscì con il n° 1 del 25 maggio 1947. Zavattini, che fondò la rivista insieme con Luciano Pedrocchi, sceneggiò personalmente le prime storie.",https://img.ilgcdn.com/sites/default/files/styles/xl/public/foto/2020/08/03/1596467836-7516463.jpg?_=1596467836,https://www.ilriformista.it/cose-il-fotoromanzo-2501/,1947/03/12
"Viene ucciso da Cosa Nostra Salvo Lima, deputato della Democrazia Cristiana al Parlamento europeo, ex sindaco di Palermo e capo della locale corrente andreottiana.","E' giovedì. Quando alle 9.20, Salvo Lima esce dal cancello della sua villa in viale delle Palme con il loden verde sulle spalle e viene freddato da due killer. Il mandante era Salvatore Reina (Secondo la sentenza del processo per l'omicidio dell'onorevole, Lima si attivò per modificare in Cassazione la sentenza del Maxiprocesso di Palermo che condannava molti altri boss all'ergastolo; tuttavia però il 30 gennaio 1992 la Cassazione confermò gli ergastoli del Maxiprocesso e sancì la validità delle dichiarazioni del pentito Tommaso Buscetta.)",https://pbs.twimg.com/media/D1c57BBW0AAhAgS.jpg,https://it.wikipedia.org/wiki/Salvo_Lima,1992/03/12
"Con la legge n. 296, per scorporo dal Ministero dell'Interno, viene istituito il Ministero della Sanità.","Formalmente  il Dicastero della Salute nacque come Ministero della Sanità, con la legge 13 marzo 1958, n. 296 per scorporo dal Ministero dell'interno, sotto il governo Fanfani II, e con l'accorpamento delle funzioni dell'Alto commissario per l'igiene e la sanità.",https://th.bing.com/th/id/OIP.L1zyZfEoRQgwGvzHAK0r1wHaFj?w=225&h=180&c=7&r=0&o=5&pid=1.7,https://www.salute.gov.it/portale/ministro/p4_2.html,1958/03/13
"La FIAT annuncia di aver stretto un'alleanza con la General Motors, primo passo per l'avvicinamento dei due colossi dell'industria automobilistica.","Il presidente di Fiat Paolo Fresco, durante la conferenza stampa al Lingotto,  ha precisato lo spirito dell'accordo che ha cambiato per sempre il più grande gruppo industriale italiano.",https://www.repubblica.it/online/economia/fiat/cantarella/ap0017a845cxw200h275c00.jpg,https://it.wikipedia.org/wiki/FIAT,2000/03/14
l'Italia aderisce agli accordi monetari di Bretton Woods (USA).,"Nel marzo del 1971 vediamo l'asione dell'italia agli accordi monetori quando nel dicembre dello stesso anno segnò l’abbandono degli accordi di Bretton Woods da parte dei membri del G10 (il gruppo dei dieci paesi formato da Germania, Belgio, Canada, Stati Uniti, Francia, Italia, Giappone, Paesi Bassi, Regno Unito, Svezia). Con lo Smithsonian Agreement il dollaro venne svalutato e si diede il via alla fluttuazione dei cambi.",https://primabergamo.it/media/2014/07/brettonwoods01-420x252.jpg,https://www.borsaitaliana.it/notizie/speciali/mercati-internazionali/accordi-bretton-woods-e-la-sua-fine.htm,1971/03/15
Viene approvato con regio decreto legge 16 marzo 1942-XX n.262 il testo del nuovo codice civile Italiano.,"E' approvato il testo del Codice civile, il testo è preceduto dalle disposizioni sul valore giuridico della Carta del Lavoro, dal  testo della Carta del Lavoro, approvato dal Gran Consiglio del Fascismo il 21 aprile 1927-V.",https://img.yumpu.com/14981668/1/500x640/rd-16-marzo-1942-n262-approvazione-del-testo-del-codice-civile-.jpg,https://www.isfol.it/sistema-documentale/banche-dati/normative/archivio/regio-decreto-16-marzo-1942-n.-262,1942/03/16
In un agguato a Roma in Via Fani le Brigate Rosse rapiscono Aldo Moro e uccidono i cinque uomini della scorta.,"Alle ore 9:00 circa in via Mario Fani, quartiere Trionfale, l'auto con a bordo Aldo Moro e quella della scorta furono bloccate all'incrocio con via Stresa da un gruppo di terroristi che aprirono immediatamente il fuoco.",https://upload.wikimedia.org/wikipedia/it/b/ba/Agguato_di_via_Fani_-_Roma%2C_1978.jpg,https://www.google.com/url?sa=i&url=https%3A%2F%2Fit.wikipedia.org%2Fwiki%2FAgguato_di_via_Fani&psig=AOvVaw1Y2eFAC3Z5emAZeVZHuNXR&ust=1635438663264000&source=images&cd=vfe&ved=0CAsQjRxqFwoTCOCj-fqB6_MCFQAAAAAdAAAAABAD,1978/03/16
"In occasione dei 150 anni dell'Unità d'Italia, solo per il 2011 viene proclamata festa nazionale.","L'anniversario dell'Unità d'Italia è una ricorrenza che cade annualmente il 17 marzo e che celebra la nascita dello Stato italiano, avvenuta in seguito alla proclamazione del Regno d'Italia del 17 marzo 1861 a Torino.",https://www.difesa.it/Content/150anniversario/PublishingImages/48118_locandina_resize.JPG,https://www.google.com/url?sa=i&url=http%3A%2F%2Fwww.difesa.it%2FContent%2F150anniversario%2FPagine%2Fdefault.aspx&psig=AOvVaw0gmWANnU5iziY7jgFFUXA6&ust=1635438935563000&source=images&cd=vfe&ved=0CAsQjRxqFwoTCIjKoYqD6_MCFQAAAAAdAAAAABAE,1961/03/17
"Milano, a due giorni dal Sequestro Moro, vengono assassinati Fausto Tinelli e Lorenzo Iannucci, del Centro Sociale Leoncavallo, presumibilmente da un commando del NAR.","I Nuclei Armati Rivoluzionari (NAR) furono un'organizzazione terroristica italiana d'ispirazione neofascista, nata a Roma e attiva dal 1977 al 1981.",http://faustoeiaio.info/media/zoo/images/fausto-iaio-murales-mancinelli_f131c86006e2f819371b209d86bd8216.jpg,https://www.google.com/url?sa=i&url=http%3A%2F%2Ffaustoeiaio.info%2Fassassinati&psig=AOvVaw2ep4ymZo-n5LNfV5W2gGwd&ust=1635440612798000&source=images&cd=vfe&ved=0CAsQjRxqFwoTCMCBmoKK6_MCFQAAAAAdAAAAABAP,1978/03/18
Prima edizione in Europa della Giornata Internazionale della Donna.,La giornata della donna si tenne per la prima volta domenica 19 marzo 1911 su scelta del Segretariato Internazionale delle donne socialiste.,https://www.sansalvo.net/archivi/immagini/2020/I/il-simbolo-della-donna-rosa-porpora-d-fatto-della-festa-della-mamma-delle-donne-di-parole-40824349-3.jpg,https://www.google.com/url?sa=i&url=https%3A%2F%2Fwww.sansalvo.net%2Fnotizie%2Fattualita%2F34383%2Fgiornata-internazionale-della-donna-la-situazione-femminile-in-italia&psig=AOvVaw2Nx-OhLtSlF8MKI9Pra55H&ust=1635443558466000&source=images&cd=vfe&ved=0CAsQjRxqFwoTCODdq52U6_MCFQAAAAAdAAAAABAK,1911/03/19
Anna Magnani vince il Premio Oscar come migliore attrice protagonista del film La rosa tatuata.,"Il 21 marzo 1956 al Pantages Theatre di Hollywood vennero assegnati i premi Oscar per il cinema. Anna Magnani vinse il premio Oscar come migliore attrice protagonista per l'interpretazione di Serafina Delle Rose nel film “The Rose Tattoo” (La Rosa Tatuata), regia di Daniel Mann.",https://www.vistanet.it/roma/wp-content/uploads/sites/4/2021/03/anna-magnani-olycom-770x480.jpg,https://www.vistanet.it/roma/2021/03/21/accadde-oggi-21-marzo-1956-lattrice-romana-anna-magnani-vince-il-premio-oscar-come-migliore-attrice-protagonista-per-la-rosa-tatuata/,1956/03/21
Giornata della memoria e dell’impegno in ricordo delle vittime innocenti delle mafie.,"Ogni anno, il 21 marzo, primo giorno di primavera, Libera celebra la Giornata della memoria e dell’impegno in ricordo delle vittime innocenti delle mafie. L'iniziativa nasce dal dolore di una mamma che ha perso il figlio nella strage di Capaci e non sente pronunciare mai il suo nome. Un dolore che diventa insopportabile se alla vittima viene negato anche il diritto di essere ricordata con il proprio nome.
Dal 1996, ogni anno, una città diversa, un lungo elenco di nomi scandisce la memoria che si fa impegno quotidiano. ",https://vivi.libera.it/it-21marzo,https://static.sky.it/images/skytg24/ansa/aosta/2022/03/07/338e8b3323f1bce070c842565efecab2.jpg.transform/hero-mobile-2x/261cd77b1257aed9898885b7d7e58c22a42aa0fc/img.jpeg,1996/03/21
Benito Mussolini fonda a Milano i Fasci italiani di combattimento.,"Il 23 marzo 1919 nella sala riunioni Circolo dell'alleanza industriale, in piazza San Sepolcro a Milano, furono ufficialmente fondati i Fasci italiani di combattimento.",https://upload.wikimedia.org/wikipedia/it/thumb/8/85/Fasci_di_combattimento_di_Lissone.jpg/220px-Fasci_di_combattimento_di_Lissone.jpg,https://www.google.com/url?sa=i&url=https%3A%2F%2Fit.wikipedia.org%2Fwiki%2FFasci_italiani_di_combattimento&psig=AOvVaw3XO-vsqz21pFWVMs8NnF1z&ust=1635441602416000&source=images&cd=vfe&ved=0CAsQjRxqFwoTCJCCsfOM6_MCFQAAAAAdAAAAABAD,1919/03/23
Esplode lo scandalo delle scommesse nel mondo del calcio. ,"Lo scandalo italiano del calcioscommesse del 1980, noto anche come Totonero, fu uno scandalo che colpì il calcio italiano nella stagione agonistica 1979-1980 e vide coinvolti giocatori, dirigenti e società di Serie A e B, tra cui Lazio, Milan, Napoli, Perugia, Bologna, Avellino, i quali truccavano le partite di campionato attraverso scommesse clandestine. La FIGC definì tali comportamneti casi di illecito sportivo. ",https://elogioallafollia.altervista.org/wp-content/uploads/2020/03/zzz-29.jpg,https://it.wikipedia.org/wiki/Scandalo_italiano_del_calcioscommesse_del_1980,1980/03/23
Incendio del traforo del Monte Bianco provocando 40 vittime.,"L'incendio del traforo del Monte Bianco si verificò la mattina del 24 marzo 1999 all'interno dell'omonima galleria. L'evento costò la vita a trentanove persone(18 dalla Francia, 13 dall'Italia, 2 dal Belgio e infine 1 dal Regno Unito, Lussemburgo, Paesi Bassi, Slovenia, Croazia e Germania)",https://aostasera.it/wp-content/uploads/elementor/thumbs/Incendio-nel-traforo-del-monte-bianco-24-marzo-1999-pc5pb8rutk5dwwmi0e3zp5vuqx643nz9bh2k1ms3go.jpg,https://it.wikipedia.org/wiki/Incendio_del_traforo_del_Monte_Bianco,1999/03/24
Elezioni politiche.,Le elezioni politiche italiane del 1934 per la nomina dei membri della Camera dei Deputati si svolsero il 25 marzo 1934. ,https://upload.wikimedia.org/wikipedia/commons/thumb/7/74/Scheda_per_la_votazione_-_Legislatura_XXIX_-_Elezioni_politiche_25_marzo_1934_-_Fronte.jpeg/555px-Scheda_per_la_votazione_-_Legislatura_XXIX_-_Elezioni_politiche_25_marzo_1934_-_Fronte.jpeg,https://it.wikipedia.org/wiki/Elezioni_politiche_italiane_del_1934,1934/03/25
Nasce l’Associazione Libera.,"Libera. Associazioni, nomi e numeri contro le mafie è un’associazione di promozione sociale presieduta da don Luigi Ciotti, fondata nel 1995 su ispirazione di Luciano Violante e Saveria Antiochia. Persegue l’intento di sollecitare la società civile nella lotta alla criminalità organizzata e favorire la creazione di una comunità alternativa alle mafie stesse.",https://upload.wikimedia.org/wikipedia/it/0/09/Logo_Libera.jpg,https://www.libera.it/,1995/03/25
"Le Brigate Rosse uccidono all'Università di Roma dove insegnava, l'economista Ezio Tarantelli.","Il 27 marzo 1985, al termine di una lezione alla facoltà di Economia e Commercio dell'Università La Sapienza di Roma, due brigatisti,sparando con una mitraglietta,  uccisero il professore, nel parcheggio dell'Ateneo. ",https://cdn.loquis.com/prod/loquis/pictures/1bd6b8bf-a966-4865-877d-7ea7bdbbd4d7.jpg,https://it.wikipedia.org/wiki/Ezio_Tarantelli#L'attentato,1985/03/27
Nel porto di Napoli scoppia un incendio sulla Caterina Costa carica di esplosivi. Nell'esplosione conseguente muoiono 600 persone.,"Lincendio divampò a bordo della Caterina Costa, una nave carica di esplosivo, ormeggiata nel porto di Napoli. L'esplosione investì la città, provocando seicento morti, tremila feriti e la distruzione degli edifici adiacenti alla zona portuale.",https://staticfanpage.akamaized.net/wp-content/uploads/sites/30/2021/03/caterina-638x360-1.jpeg,https://www.google.com/url?sa=i&url=https%3A%2F%2Fwww.fanpage.it%2Fnapoli%2F75-anni-fa-nel-porto-di-napoli-la-tragedia-della-caterina-costa-che-causo-300-morti%2F&psig=AOvVaw3ahy1ULhLNV0uDbvgV9iQw&ust=1635442870286000&source=images&cd=vfe&ved=0CAsQjRxqFwoTCNj559CR6_MCFQAAAAAdAAAAABAD,1943/03/28
Fine attività eruttiva dell'Etna,Il 30 gennaio 1974 si aprì una frattura sul versante occidentale del vulcano a quota 1650 m.s.l.m. Subito iniziarono ad innalzarsi forti esplosioni stromboliane al ritmo di 30-50 al minuto.,https://image.jimcdn.com/app/cms/image/transf/dimension=640x1024:format=jpg/path/s85a5753bd032346f/image/i0690f0216ef2f42e/version/1371455560/image.jpg,https://www.ct.ingv.it/index.php/ricerca/i-vulcani-siciliani/etna/l-attivita-esplosiva-dell-etna,1974/03/29
Quarto governo Giolitti,"Il Governo Giolitti IV è stato il governo del Regno d'Italia in carica dal 30 marzo 1911 al 21 marzo 1914, per un totale di 1.076 giorni, ovvero 2 anni, 11 mesi e 8 giorni. Il governo, presieduto dal politico Giovanni Giolitti (1842-1928), nacque dalla proposta che questi fece di introdurre il suffragio universale maschile.",https://upload.wikimedia.org/wikipedia/commons/thumb/9/93/Giolitti2.jpg/212px-Giolitti2.jpg,https://www.google.com/imgres?imgurl=https%3A%2F%2Fupload.wikimedia.org%2Fwikipedia%2Fcommons%2Fthumb%2F9%2F93%2FGiolitti2.jpg%2F212px-Giolitti2.jpg&imgrefurl=https%3A%2F%2Fit.wikipedia.org%2Fwiki%2FGoverno_Giolitti_IV&tbnid=Ekxb33rcY2dRKM&vet=12ahUKEwiq6qunlevzAhUi4uAKHUZuA38QMygBegUIARCqAQ..i&docid=1A6CYOouxh97XM&w=212&h=299&q=quarto%20governo%20Giolitti%20in%20Italia&hl=it&ved=2ahUKEwiq6qunlevzAhUi4uAKHUZuA38QMygBegUIARCqAQ,1911/03/30
"Il Parlamento italiano istituisce il Giorno del ricordo, in memoria delle vittime delle foibe e dell'esodo degli istriani, fiumani e dalmati.","Dal 2004 il Parlamento italiano ha istituito il “Giorno del Ricordo”, da celebrare ogni anno il 10 febbraio, con l'obiettivo di conservare e rinnovare la memoria della tragedia degli italiani e di tutte le vittime delle Foibe.",https://www.rai.it/dl/img/2021/02/08/1600x900_1612808299110_il%20giorno%20del%20ricordo%20vittime%20foibe.jpg,https://www.google.com/url?sa=i&url=https%3A%2F%2Fwww.rai.it%2Fufficiostampa%2Fassets%2Ftemplate%2Fus-articolo.html%3FssiPath%3D%2Farticoli%2F2021%2F02%2F10-febbraio---Il-Giorno-del-Ricordo-c58bc704-3c36-4e3f-a891-c261dc0602b8-ssi.html&psig=AOvVaw1EAlkNapXFQEBX9gS8QUMA&ust=1635523734293000&source=images&cd=vfe&ved=0CAsQjRxqFwoTCLj5_-6-7fMCFQAAAAAdAAAAABAD,2004/03/30
A Roma viene firmato un accordo segreto fra la destra politica spagnola e il fascismo italiano.,Le relazioni tra l’Italia e la Spagna mutarono significativamente dopo la caduta della monarchia. Si concluse in questo modo lo stretto rapporto che il governo spagnolo aveva mantenuto con l’Italia fascista.,https://www.ilmessaggero.it/photos/PANORAMA/97/76/3639776_1929_legione_condor_per_guerra_spagna.jpg,https://www.google.com/imgres?imgurl=https%3A%2F%2Fwww.ilmessaggero.it%2Fphotos%2FPANORAMA%2F97%2F76%2F3639776_1929_legione_condor_per_guerra_spagna.jpg&imgrefurl=https%3A%2F%2Fwww.ilmessaggero.it%2Frubriche%2Faccadde_oggi%2Faccordo_segreto_destra_spagnola_italiana-3639776.html&tbnid=6_U4Kwq704YL4M&vet=12ahUKEwjMqoysye3zAhXAgv0HHTdKCvMQMygAegQIARAR..i&docid=E2t9--BQcZb-VM&w=660&h=227&itg=1&q=A%20Roma%20viene%20firmato%20un%20accordo%20segreto%20tra%20la%20destra%20politica%20spagnola%20e%20il%20fascismo%20italiano.&hl=it&ved=2ahUKEwjMqoysye3zAhXAgv0HHTdKCvMQMygAegQIARAR,1934/03/31
Il re Vittorio Emanuele III inaugura la Città universitaria di Roma.,"La cittadella universitaria venne inaugurata il 31 marzo 1935 alla presenza del re Vittorio Emanuele III. L'entrata principale è oggi situata in piazzale Aldo Moro, al civico 5, dove ha sede anche il limitrofo Consiglio Nazionale delle Ricerche.",https://conoscerelastoria.it/wp-content/uploads/2020/03/1280px-Cittauniversitaria35.jpg,https://www.google.com/imgres?imgurl=https%3A%2F%2Fconoscerelastoria.it%2Fwp-content%2Fuploads%2F2020%2F03%2F1280px-Cittauniversitaria35.jpg&imgrefurl=https%3A%2F%2Fconoscerelastoria.it%2Faccadde-oggi-roma-re-vittorio-emanuele-iii-inaugura-la-citta-universitaria%2F&tbnid=fOrLY6YYRYBVEM&vet=12ahUKEwjWvr-_yu3zAhUF0LsIHbeOBoMQMygAegQIARAb..i&docid=OsctVnEdmzr8tM&w=1280&h=809&q=Il%20re%20Vittorio%20Emanuele%20III%20inaugura%20la%20Citt%C3%A0%20universitaria%20di%20Roma.&hl=it&ved=2ahUKEwjWvr-_yu3zAhUF0LsIHbeOBoMQMygAegQIARAb,1935/03/31
"Scontri dopo il derby calcistico tra Roma e Lazio: 41 feriti, 3 arresti.","Circa cinquanta feriti fra tifosi e forze dell'ordine, quattro persone colpite da infarto, numerosi contusi, un giovane arrestato, costituiscono il pesante bilancio dei gravi incidenti accaduti dentro e fuori lo stadio olimpico al termine della partita di calcio Roma-Lazio.",https://www.ilmessaggero.it/photos/MED/05/74/1060574_20150526_c1_sangue.jpg,https://www.google.com/url?sa=i&url=https%3A%2F%2Fwww.ilmessaggero.it%2FROMA%2FCRONACA%2Fderby_lazio_roma_sangue_scontri_accoltellati_stadio%2Fnotizie%2F1379654.shtml&psig=AOvVaw3sqzpYYF1NhTTJ3q9PBirJ&ust=1635527003759000&source=images&cd=vfe&ved=0CAsQjRxqFwoTCLCaq4jL7fMCFQAAAAAdAAAAABAJ,1974/03/31
Battaglia di villa Giulia,"La battaglia di Valle Giulia: gli scontri tra studenti e polizia nel 1968 L'1 marzo 1968 presso la Facoltà di Architettura dell'Università La Sapienza di Roma, sita presso una zona chiamata Valle Giulia, avviene uno scontro di piazza tra manifestanti universitari e polizia.",https://th.bing.com/th/id/R.d2eedcbd5963f3ec222333c24857c918?rik=WprhfBEd8SqLog&riu=http%3a%2f%2filglobo.com.au%2fmedia%2fcache%2f0e%2fc9%2fx0ec94acf027c962845b2ea518d81ef35.jpg.pagespeed.ic.xUEQ2-D1tw.jpg&ehk=VHfTMXbsEaTDtP4EKXxnwViCVtYPi9clCf9HoY0ed%2fw%3d&risl=&pid=ImgRaw&r=0,"https://www.fattiperlastoria.it/battaglia-valle-giulia-scontri-1968/#:~:text=La%20battaglia%20di%20Valle%20Giulia%3A%20gli%20scontri%20tra,scontro%20di%20piazza%20tra%20manifestanti%20universitari%20e%20polizia.",1968/03/1
Uccisione Petrosino,Il 12 marzo del 1909 venne ucciso a Palermo il poliziotto italo-americano Joe Petrosino. Era in missione segreta in Sicilia per cercare di recidere i legami tra la Mafia e la Mano Nera che consentivano ai peggiori pregiudicati di espatriare negli Stati Uniti.,https://tgfuneral24.it/wp-content/uploads/2017/03/joe_petrosino.jpg,uccisione petrosino 1909 - Cerca (bing.com),1909/03/12